{
  "vuls_version": "0.1.0",
  "record_id": "example-weight-0002",
  "subject": {
    "subject_id": "synthetic-dog-002",
    "species": "Canis lupus familiaris",
    "breed": "Labrador Retriever",
    "sex": "male",
    "birth_date": "2018-04-12"
  },
  "observation": {
    "concept": "body_weight",
    "value": 31000,
    "unit": "g",
    "observed_at": "2026-10-31T09:30:00Z"
  },
  "method": {
    "method_type": "direct_measurement",
    "method_name": "Example calibrated scale"
  },
  "provenance": {
    "source_type": "research_collected",
    "source_name": "Synthetic demonstration dataset"
  },
  "quality": {
    "status": "unverified",
    "completeness": "complete",
    "flags": [
      "synthetic_example"
    ]
  },
  "permission": {
    "publication_status": "open",
    "permitted_uses": [
      "research",
      "public_redistribution"
    ],
    "licence": "CC0-1.0"
  }
}
