{
  "vuls_version": "0.1.0",
  "record_id": "example-stool-0001",
  "subject": {
    "subject_id": "synthetic-dog-001",
    "species": "Canis lupus familiaris",
    "breed": "Golden Retriever",
    "sex": "female",
    "age": {
      "value": 8,
      "unit": "year",
      "estimated_on": "2026-10-31"
    }
  },
  "observation": {
    "concept": "stool_consistency",
    "value": "formed",
    "observed_at": "2026-10-31T13:00:00Z"
  },
  "method": {
    "method_type": "owner_reported",
    "method_name": "Owner description"
  },
  "provenance": {
    "source_type": "owner_reported",
    "source_name": "Synthetic demonstration dataset"
  },
  "quality": {
    "status": "unverified",
    "completeness": "complete",
    "flags": [
      "synthetic_example"
    ]
  },
  "permission": {
    "publication_status": "open",
    "permitted_uses": [
      "research",
      "public_redistribution"
    ],
    "licence": "CC0-1.0"
  }
}
